title,description,link,content
"Carro de mais de R$ 200 mil furtado em Piracicaba é apreendido na Dutra, em Caçapava","O motorista, de 43 anos, foi levado para a delegacia da Polícia Civil.",https://g1.globo.com/sp/vale-do-paraiba-regiao/noticia/2024/12/05/carro-de-mais-de-r-200-mil-furtado-em-piracicaba-e-apreendido-na-dutra-em-cacapava.ghtml, ✅ Clique aqui para seguir o canal do g1 Vale do Paraíba e região no WhatsApp
Quase cinco mil trabalhadores ainda não receberam o pagamento do 13º nas regiões de Sorocaba e Itapetininga,"Dados são do Ministério do Trabalho e Emprego. O número de 2024, que se refere apenas às denúncias, é referente a oito cidades.",https://g1.globo.com/sp/sorocaba-jundiai/noticia/2024/12/05/quase-cinco-mil-trabalhadores-ainda-nao-receberam-o-pagamento-do-13o-nas-regioes-de-sorocaba-e-itapetininga.ghtml,
Homem é preso após morte a pauladas em Ribeirão Preto; VÍDEO,"Vítima ainda não foi identificada. Suspeito, de 25 anos, confessou crime e alegou que agiu após ser acusado de tentativa de estupro.",https://g1.globo.com/sp/ribeirao-preto-franca/noticia/2024/12/05/homem-e-preso-apos-morte-a-pauladas-em-ribeirao-preto-video.ghtml,
"Após cinco meses, causa de acidente com ônibus de romeiros que deixou 10 mortos ainda é desconhecida","Acidente, que aconteceu na madrugada do dia 5 de julho, no quilômetro 171 da Rodovia Francisco da Silva Pontes (SP-127). Além das mortes, mais de 40 pessoas ficaram feridas.",https://g1.globo.com/sp/itapetininga-regiao/noticia/2024/12/05/apos-cinco-meses-causa-de-acidente-com-onibus-de-romeiros-que-deixou-10-mortos-ainda-e-desconhecida.ghtml,
A turbulenta história dos presidentes da Coreia do Sul,"País já teve presidentes condenados, presos, um caso de suicídio, outro de assassinato e até pena de morte. Apenas três líderes democráticos completaram mandato sem intercorrências.",https://g1.globo.com/mundo/noticia/2024/12/05/a-turbulenta-historias-dos-presidentes-da-coreia-do-sul.ghtml,
PF de Campinas prende três em operação contra abuso sexual de crianças e adolescentes,"Objetivo é combater a exploração sexual interrompendo a circulação pela internet de conteúdos de pornografia infantojuvenil. No total, são cumpridos quatro mandados de busca e apreensão.",https://g1.globo.com/sp/campinas-regiao/noticia/2024/12/05/pf-de-campinas-cumpre-mandados-em-operacao-contra-abuso-sexual-de-criancas-e-adolescentes.ghtml,
"Após interdição para obras na ponte sobre o Rio Tietê, Rodovia Assis Chateaubriand é liberada em Barbosa",Trecho da rodovia que passa pela ponte em Barbosa (SP) ficou interditado por dois meses. Passagem de veículos será liberada às 10h desta quinta-feira (5).,https://g1.globo.com/sp/sao-jose-do-rio-preto-aracatuba/noticia/2024/12/05/apos-interdicao-para-obras-na-ponte-sobre-o-rio-tiete-rodovia-assis-chateaubriand-e-liberada-em-barbosa.ghtml,
Operação na Apae de Bauru: polícia identificou movimentações financeiras de quase R$ 7 milhões feitas por suspeitos,"Investigação é realizada em paralelo ao inquérito que apura o suposto assassinato da secretária executiva da entidade, Cláudia Lobo, desaparecida desde agosto. Oito pessoas foram presas suspeitas de envolvimento no esquema - entre elas, filha, irmã, cunhado e ex-marido de Cláudia.",https://g1.globo.com/sp/bauru-marilia/noticia/2024/12/05/operacao-na-apae-de-bauru-policia-identificou-movimentacoes-financeiras-de-quase-r-7-milhoes-feitas-por-suspeitos.ghtml,
"Após chuva, semáforos amanhecem apagados ou com falhas em diferentes bairros de São Luís","A chuva provocou queda de energia em bairros como Vinhais, Bequimão, São Francisco, Areinha e Anjo da Guarda.",https://g1.globo.com/ma/maranhao/noticia/2024/12/05/apos-chuva-semaforos-amanhecem-apagados-ou-com-falhas-em-diferentes-bairros-de-sao-luis.ghtml, ✅ Clique aqui para seguir o novo canal do g1 Maranhão no WhatsApp
Acidente provoca quatro mortes na Rodovia dos Bandeirantes,"Segundo equipes de resgate, vítimas trabalhavam em uma obra, na altura do km 55 da rodovia, em Jundiaí (SP). Acidente envolveu dois caminhões e um carro.",https://g1.globo.com/sp/sorocaba-jundiai/noticia/2024/12/05/acidente-provoca-mortes-na-rodovia-dos-bandeirantes.ghtml,
Obras para nova praça com vista privilegiada de BH são iniciadas; veja como vai ficar,"Prefeitura concluiu a demolição do edifício anexo do Conjunto Sulacap-Sulamérica, que dará espaço à Praça da Independência, no Hipercentro de Belo Horizonte, com direito a vista para o Viaduto Santa Tereza. O g1 foi conferir como está o andamento das obras.",https://g1.globo.com/mg/minas-gerais/noticia/2024/12/05/obras-para-nova-praca-com-vista-privilegiada-de-bh-sao-iniciadas-veja-como-vai-ficar.ghtml,
Obras para nova praça com vista privilegiada de BH são iniciadas; veja como vai ficar,"Prefeitura concluiu a demolição do edifício anexo do Conjunto Sulacap-Sulamérica, que dará espaço à Praça da Independência, no Hipercentro de Belo Horizonte, com direito a vista para o Viaduto Santa Tereza. O g1 foi conferir como está o andamento das obras.",https://g1.globo.com/mg/minas-gerais/noticia/2024/12/05/obras-para-nova-praca-com-vista-privilegiada-de-bh-sao-iniciadas-veja-como-vai-ficar.ghtml,
Ministério Público pede prisão de PM que executou homem negro pelas costas em frente a mercado em SP,Imagens de câmeras de segurança registraram quando Vinicius de Lima Britto atirou em um jovem acusado de furtar um mercado na Zona Sul da capital em 3 de novembro.,https://g1.globo.com/sp/sao-paulo/noticia/2024/12/05/ministerio-publico-pede-prisao-de-pm-que-executou-homem-negro-pelas-costas-em-frente-a-mercado-em-sp.ghtml, ✅ Clique aqui para se inscrever no canal do g1 SP no WhatsApp
"Pediatra Fernando Cunha Lima, acusado de estuprar crianças, está foragido há um mês","O pediatra é acusado de estuprar seis crianças, dentro do próprio consultório do médico, em João Pessoa. A Polícia Civil cumpriu tentou cumprir um mandado de prisão no início do mês de novembro, mas não encontrou o médico em casa.",https://g1.globo.com/pb/paraiba/noticia/2024/12/05/pediatra-fernando-cunha-lima-acusado-de-estuprar-criancas-esta-foragido-ha-um-mes.ghtml,
"VÍDEO: mulher imobiliza e golpeia suposto assaltante em supermercado no Sol Nascente, DF",Outra mulher tentou separar briga. Vítima que reagiu é funcionária do mercado e disse que mulher que tentou ajudar é esposa do assaltante e que também trabalha no local.,https://g1.globo.com/df/distrito-federal/noticia/2024/12/05/video-mulher-imobiliza-e-golpeia-suposto-assaltante-em-supermercado-no-sol-nascente-df.ghtml, ✅ Clique aqui para seguir o canal do g1 DF no WhatsApp.
Inscrições no concurso da prefeitura de Nazarezinho começam nesta quinta-feira,Candidatos podem ser inscrever até o dia 12 de janeiro.,https://g1.globo.com/pb/paraiba/noticia/2024/12/05/concurso-da-prefeitura-de-nazarezinho-inscricoes.ghtml, 📲 Compartilhe esta notícia pelo Whatsapp📲 Compartilhe esta notícia pelo Telegram 📝Confira o edital do concurso da prefeitura de Nazarezinho
"Seguranças são demitidos mais de 20 dias após morte de passageiro em estação de trem de Carapicuíba, na Grande SP",Perícia apontou que Jadson Pires morreu 'asfixia mecânica em decorrência de esganadura'. Três seguranças foram ouvidos pela Polícia Civil e um deles foi preso.,https://g1.globo.com/sp/sao-paulo/noticia/2024/12/05/viamobilidade-demite-seis-segurancas-por-agressoes-que-mataram-passageiro-em-estacao-de-carapicuiba-na-grande-sp.ghtml, ✅ Clique aqui para se inscrever no canal do g1 SP no WhatsApp
Mito ou realidade: aparelho em stand-by gasta energia?,"O consumo das luzinhas de espera é baixo e pode diminuir ainda mais se desligar o LED em TVs e aparelhos de ar-condicionado, por exemplo.",https://g1.globo.com/guia/guia-de-compras/casa/saiba-se-aparelho-em-stand-by-gasta-energia.ghtml," 🚨 Exemplos não faltam: o relógio do micro-ondas, o LED vermelho da televisão e o alto-falante conectado o tempo todo – perguntar ""Alexa, qual a previsão do tempo?"" requer energia e wi-fi. AMIGO SECRETO: 25 sugestões de presentes até R$ 50 e R$ 100FÃS DE TECNOLOGIA: veja lista com 20 ideias para presentear✅Clique aqui para seguir o canal do Guia de Compras do g1 no WhatsAppTODOS OS GUIAS DE COMPRAS 📺 Considerando 3W de potência por aparelho em uma casa com duas TVs, um micro-ondas, uma lavadora de roupas e um computador, seriam 15W de potência em modo stand-by. 💵 Se um kWh custar em torno de R$ 0,80, o incremento na conta de luz será de R$ 8,64, em média. 💸 Para comparação, lembra o especialista, utilizar um chuveiro elétrico de 5.500W por 20 minutos ao dia, representa 1,83 kWh ao dia ou 55 kWh ao mês. Esse consumo equivale a R$ 44 na conta de luz. 💡 Dá para apagar a luzinha, pelo menos?"
Ex-funcionária de supermercado no AC é condenada a devolver mais de R$ 444 mil desviados ao longo de 4 anos,Valores foram desviados entre 2010 e 2014 das contas de um supermercado atacadista de Rio Branco. Acusada diz que só obedecia ordens e que foi tudo armado.,https://g1.globo.com/ac/acre/noticia/2024/12/05/ex-funcionaria-de-supermercado-no-ac-e-condenada-a-devolver-mais-de-r-444-mil-desviados-ao-longo-de-4-anos.ghtml,
Corte de gastos: Câmara aprova pedido de urgência para votação de parte das medidas,"Em votação, a Câmara dos Deputados aprovou o pedido de urgência para dois projetos de lei que fazem parte do pacote de corte de gastos.",https://g1.globo.com/hora1/video/corte-de-gastos-camara-aprova-pedido-de-urgencia-para-votacao-de-parte-das-medidas-13159229.ghtml,
"Ceará tem concurso público com 40 vagas para PGE e salários de R$ 5,9 mil",Inscrições podem ser feitas a partir de 19 de dezembro de 2024.,https://g1.globo.com/ce/ceara/suachance/noticia/2024/12/05/ceara-tem-concurso-publico-com-40-vagas-para-pge-e-salarios-de-r-59-mil.ghtml, ✅ Siga o canal do g1 Ceará no WhatsApp
"VÍDEOS: Bom Dia Goiás desta quinta-feira, 5 de dezembro de 2024","Veja os vídeos desta quinta-feira, 5 de dezembro de 2024.",https://g1.globo.com/go/goias/edicao/2024/12/05/videos-bom-dia-goias-desta-quinta-feira-5-de-dezembro-de-2024.ghtml,
"Alavancada pelos transportes, emissão de gases do efeito estufa tem alta na região de Piracicaba","Estudo divulgado pelo Laboratório do Clima apontou crescimento de 2,2% de 2022 para 2023. Setor de transporte rodoviário é responsável por 45,44% das emissões.",https://g1.globo.com/sp/piracicaba-regiao/noticia/2024/12/05/alavancada-pelos-transportes-emissao-de-gases-do-efeito-estufa-tem-alta-na-regiao-de-piracicaba.ghtml,
Viúva condenada por morte do marido é presa 14 anos após o crime,"Segundo a polícia, Maria Cunha Vieira planejou o assassinato com a ajuda do amante, que foi preso. Durante as investigações, ela levantou falsas suspeitas e acusou outro homem e os próprios filhos do crime.",https://g1.globo.com/rj/rio-de-janeiro/noticia/2024/12/05/viuva-condenada-por-morte-do-marido-e-presa-14-anos-apos-o-crime.ghtml,
"Carreta com quase 4 toneladas de maconha é apreendida após motorista pular do veículo em movimento, em Pirapozinho","Suspeito, de nacionalidade paraguaia, foi preso em uma mata próxima a Rodovia Assis Chateaubriand (SP-425). Droga estava escondida em meio a carga de arroz.",https://g1.globo.com/sp/presidente-prudente-regiao/noticia/2024/12/05/carreta-com-quase-4-toneladas-de-maconha-e-apreendida-apos-motorista-pular-do-veiculo-em-movimento-em-pirapozinho.ghtml, 📱 Participe do Canal do g1 Presidente Prudente e Região no WhatsApp
"Macron aceita renúncia de premiê, mas pede que ele siga no poder enquanto decide novo nome para o cargo","Michel Barnier, que teve moção de censura aprovada pelo Parlamento francês na quarta (4), entregou pedido de renúncia nesta manhã ao presidente em Paris. Macron deve agora escolher substituto ou negociar com esquerda e extrema direita.",https://g1.globo.com/mundo/noticia/2024/12/05/primeiro-ministro-franca-renuncia.ghtml, ✅ Clique aqui para seguir o canal de notícias internacionais do g1 no WhatsApp
"O que fazer em Campinas e região: agenda tem Michel Teló, Bruna Louise, Budah, Renato Albani e mais",Há diversas atrações pagas e gratuitas para todos as idades a partir desta quinta-feira (4).,https://g1.globo.com/sp/campinas-regiao/em-cena/noticia/2024/12/05/o-que-fazer-em-campinas-e-regiao-agenda-tem-michel-telo-bruna-louise-budah-renato-albani-e-mais.ghtml," 📅 Veja os destaques desta semana: 🎤 A rapper gaúcha BUDAH estará na casa de shows Pista 2002, neste sábado (7), em Campinas. 😄 Se quiser dar risada, o humorista Renato Albani desembarca em Campinas (SP) com o seu show de humor 'Zona de conforto'.👠 A comediante Bruna Louise apresenta o seu show de stand-up ""Ela Tá Correndo Atrás"", em Valinhos (SP). Ingressos custam a partir de R$40.🤠 Não abre mão de um sertanejo? O cantor Michel Teló estará em Indaiatuba (SP) com um show gratuito, para a inauguração do Centro Esportivo 'Rei Pelé'.🔨 No Ame Club, em Valinhos, grandes nomes do Hard Techno, vertente da música eletrônica, se reunem no sábado no festival Verknipt, que chega pela primeira vez no Brasil. 🎄 Para quem já está em clima natalino, o Natal de Holambra acontece até 22 de dezembro. 📌 Clique na cidade desejada e confira as atrações: O que: visitas para a observação do planeta dos anéis 🪐, divididas em até três grupos de 15 pessoas por noite.Data: até 18 de dezembroHorários: às quartas e sextas-feiras, a partir das 20hLocal: Observatório Municipal de AmericanaEndereço: Jardim Botânico - Rua Abrahim Abraham, s/nº - Jardim Ipiranga, AmericanaQuanto: entrada gratuita, mediante a agendamento, pelo telefone (19) 3408-4800 🔎 SAIBA MAIS EM: Campinas recebe espetáculo de Natal gratuito 'à luz de velas' nesta sexta 💿 Line-up 🔎 CONFIRA A PROGRAMAÇÃO COMPLETA: 'Natal de Holambra' tem shows, gastronomia e chuva de neve"
Suspeito de ser chefe do tráfico de drogas em aglomerado é preso,Polícia Militar capturou o criminoso na noite desta quarta-feira. Uma pistola 9mm que estava com ele foi apreendida.,https://g1.globo.com/mg/minas-gerais/noticia/2024/12/05/suspeito-de-ser-chefe-do-trafico-de-drogas-em-aglomerado-e-preso.ghtml,
Justiça homologa acordo entre Governo do RJ e Supervia para transição do serviço de trens,A decisão é da 6ª Vara Empresarial da Capital. Governo nomeou Cesar Ferraz Mastrangelo para atuar como observador do poder público durante o período de transição.,https://g1.globo.com/rj/rio-de-janeiro/noticia/2024/12/05/justica-homologa-acordo-entre-governo-do-rj-e-supervia-para-transicao-do-servico-de-trens.ghtml,
PSS da Prefeitura de Delmiro Gouveia oferta vagas na área da assistência social; veja como se inscrever,"Inscrições encerram nesta quinta-feira (5), às 17h.",https://g1.globo.com/al/alagoas/noticia/2024/12/05/pss-da-prefeitura-de-delmiro-gouveia-oferta-vagas-na-area-da-assistencia-social-veja-como-se-inscrever.ghtml,
Cinco morrem e 36 ficam feridos em batida entre dois ônibus e uma carreta no interior da Bahia,"Batida aconteceu na BR-110, em Olindina, cidade a 218 km de Salvador. 90 pessoas se envolveram na colisão.",https://g1.globo.com/ba/bahia/noticia/2024/12/05/batida-em-rodovia-na-bahia.ghtml, Assista aos vídeos do g1 e TV Bahia 💻
Bitcoin supera cotação de US$ 100 mil pela primeira vez na história graças a Trump,"Valor da moeda virtual disparou, valorizando quase 50%, desde eleição do republicano nos EUA, em 6 de novembro. Bitcoin foi vendido nas bolsas asiáticas nesta quinta (5) a US$ 102,7 mil (cerca de R$ 620 mil).",https://g1.globo.com/economia/noticia/2024/12/05/bitcoin-supera-us-100-mil.ghtml,
"VÍDEOS: MG2 de quarta-feira, 4 de dezembro de 2024",Assista aos vídeos do telejornal com as notícias de Minas Gerais.,https://g1.globo.com/mg/minas-gerais/videos-mg2/playlist/videos-mg2-de-quarta-feira-4-de-dezembro-de-2024.ghtml,
Fósseis encontrados por trabalhadores  são recolhidos pela polícia e entregues a museu no Ceará,Material ficará exposto no Museu de Paleontologia Plácido Cidade Nuvens.,https://g1.globo.com/ce/ceara/cariri/noticia/2024/12/05/fosseis-encontrados-por-trabalhadores-sao-recolhidos-pela-policia-e-entregues-a-museu-no-ceara.ghtml, ✅ Clique aqui para seguir o canal do g1 Ceará no WhatsApp
"No AP, segunda fase da campanha municipal antirrábica será realizada em 16 bairros; veja locais",Ação acontece neste sábado (7) atendendo bairros da Zona Sul e área Central da capital.,https://g1.globo.com/ap/amapa/noticia/2024/12/05/no-ap-segunda-fase-da-campanha-municipal-antirrabica-sera-realizada-em-16-bairros-veja-locais.ghtml, ✅ Clique aqui para seguir o canal do g1 AP no WhatsApp
"Menino de três anos com cárie teve 14 dentes arrancados em cirurgia: 'Conseguiram restaurar 11', diz mãe","Nicollas Gabriel já não conseguia se alimentar direito por causa de cáries que atingiram todos os dentes. Apesar da perda, Divina Alves Oliveira contou que os dentes eram de leite e vão nascer novamente.",https://g1.globo.com/to/tocantins/noticia/2024/12/05/menino-de-tres-anos-com-carie-teve-14-dentes-arrancados-em-cirurgia-conseguiram-restaurar-11-diz-mae.ghtml,
"Surpreso com indicação ao Grammy Latino, Tiago Iorc faz show 'celebrativo' e exclusivo em SP para concluir ciclo","Cantor apresenta na íntegra álbum 'Antes Que o Mundo Acabe' na Audio na segunda-feira (9). Ao g1, Tiago falou sobre sua nova fase na música após pausa que marcou carreira, motivos de realizar apenas uma apresentação e a sensação de ter mais um trabalho indicado ao prêmio.",https://g1.globo.com/guia/guia-sp/noticia/2024/12/05/surpreso-com-indicacao-ao-grammy-latino-tiago-iorc-faz-show-celebrativo-e-exclusivo-em-sp-para-concluir-ciclo.ghtml," 🗓️ Quando? Segunda-feira (9), às 20h30📍Onde? Audio | Av. Francisco Matarazzo, 694 - Barra Funda, Zona Oeste💲Quanto? A partir de R$ 120➡️Mais informações e ingressos"
Corte Interamericana de Direitos Humanos condena estado brasileiro pelo desaparecimento de 11 jovens na Favela de Acari,"O crime aconteceu em um sítio em Suruí, Magé, na Baixada Fluminense, em 1990. Corpos nunca foram encontrados.",https://g1.globo.com/rj/rio-de-janeiro/noticia/2024/12/05/corte-interamericana-de-direitos-humanos-condena-estado-brasileiro-pelo-desaparecimento-de-11-jovens-na-favela-de-acari.ghtml,
Alunos de escola pública em Roraima se despedem do ensino médio com vídeo ao som de 'Aquarela' e viralizam: 'obra prima',"Vídeo foi feito por alunos do Colégio Estadual Militarizado Professora Maria De Lourdes Neves, na zona Oeste de Boa Vista, e já conta com mais de 3 milhões de visualizações nas redes sociais.",https://g1.globo.com/rr/roraima/noticia/2024/12/05/alunos-de-escola-publica-em-roraima-se-despedem-do-ensino-medio-com-video-ao-som-de-aquarela-e-viralizam-obra-prima.ghtml," 🎨 Uma das músicas mais conhecidas do cenário musical brasileiro, ""Aquarela"" foi escrita em parceria com Vinícius de Moraes e fala sobre a finitude da vida, como se um dia tudo fosse se descolorir, mas de uma maneira muito ""disfarçada, lírica e até lúdica"" — conforme definição do próprio autor. ✅ Receba as notícias do g1 Roraima no WhatsApp 💡 Um dos responsáveis pelo roteiro, o estudante explicou que a ideia surgiu da vontade dos alunos de colecionar momentos e memórias em um vídeo já que com conclusão do ensino e com compromissos que podem surgir na nova fase da vida deles, alguns colegas não se verão com frequência. 🎥 Ele foi publicado na terça-feira (2) na conta criada especialmente para a turma, onde eles já registravam momentos e guardavam as lembranças do último ano escolar. Os estudantes, no entanto, não esperavam que os vídeos tivessem muito alcance, como aconteceu com o de despedida."
Exército cassa registro de CAC de coronel indiciado por explosão em apartamento e posse ilegal de armas,"Documento do Exército obtido pelo g1 aponta que o militar cometeu três faltas graves e, com isso, recebeu a penalidade de cassação do registro.",https://g1.globo.com/sp/campinas-regiao/noticia/2024/12/05/exercito-cassa-registro-de-cac-de-coronel-indiciado-por-explosao-de-arsenal-e-posse-ilegal-de-armas-em-campinas.ghtml,
"Sobe para 17 o número de vítimas de abusos cometidos por professor de jiu-jitsu preso em Manaus, diz polícia","Com os novos depoimentos de vítimas, a delegada responsável pelo caso tem estendido o prazo para tomar o depoimento do suspeito, que está previsto para acontecer na sexta-feira (6).",https://g1.globo.com/am/amazonas/noticia/2024/12/05/sobe-para-17-o-numero-de-vitimas-de-abusos-cometidos-por-professor-de-jiu-jitsu-preso-em-manaus-diz-policia.ghtml,
Aposentado por idade: o que se sabe sobre processo contra desembargador que concedeu benefício a suposto chefe do tráfico,"Detento fugiu logo após concessão da prisão domiciliar, em outubro de 2023, e não foi mais localizado. O Tribunal de Justiça da Bahia (TJ-BA) publicou aposentadoria compulsória de Luiz Fernando Lima no dia 25 de novembro.",https://g1.globo.com/ba/bahia/noticia/2024/12/05/aposentado-por-idade-o-que-se-sabe-sobre-processo-contra-desembargador-que-concedeu-beneficio-a-suposto-chefe-do-trafico.ghtml," Para o Conselho, ""as condutas em apuração denotam indícios gravíssimos de comprometimento da imparcialidade, da transparência e dos deveres de prudência e cautela do magistrado"". O desembargador nega que tenha obtido qualquer proveito com a medida. Entenda abaixo o que se sabe e o que falta esclarecer sobre o caso ⬇️ Assista aos vídeos do g1 e TV Bahia 💻"
Homem que furtou cão de creche levando animal à morte foi condenado pela Justiça em Fortaleza,"Acusado deve cumprir mais de 5 anos de reclusão, no regime semiaberto, além de pagar indenização aos tutores no animal.",https://g1.globo.com/ce/ceara/noticia/2024/12/05/homem-que-furtou-cao-de-creche-levando-animal-a-morte-foi-condenado-pela-justica-em-fortaleza.ghtml, ✅ Clique aqui para seguir o canal do g1 Ceará no WhatsApp
Ex de fisioterapeuta atropelado e morto após casamento diz que filho tremeu 'da cabeça aos pés' ao receber notícia,"Fábio Toshiro morreu em julho de 2024, no Rio de Janeiro. O filho dele, de 15 anos, mora com a mãe nos Estados Unidos.",https://g1.globo.com/sp/santos-regiao/noticia/2024/12/05/ex-de-fisioterapeuta-atropelado-e-morto-apos-casamento-diz-que-filho-tremeu-da-cabeca-aos-pes-ao-receber-noticia.ghtml, ✅ Clique aqui para seguir o novo canal do g1 Santos no WhatsApp.
Viúva e irmã de comerciante morto tiveram envolvimento amoroso e estão detidas no mesmo presídio,"Rafaela Costa e Marcelly Peretto foram presas por envolvimento no assassinato de Igor Peretto, em Praia Grande (SP). As mulheres não estão na mesma cela, mas podem ter contato nas áreas de convivência entre as detentas.",https://g1.globo.com/sp/santos-regiao/noticia/2024/12/05/viuva-e-irma-de-comerciante-morto-tiveram-envolvimento-amoroso-e-estao-detidas-no-mesmo-presidio.ghtml, ✅Clique aqui para seguir o canal do g1 Santos no WhatsApp.
Vereadora chama homicida e vítima de feminicídio de doentes em sessão: 'Quem é pior?',"Sirana Bosonkian (PDT), parlamentar em Guarujá (SP), se manifestou sobre crimes contra mulheres, como o assassinato da empresária Brenda Bulhões, morta a tiros na cidade, e perguntou: quem é pior? Quem mata ou quem não denuncia. Procurada, a vereadora reconheceu que algumas falas foram mal colocadas.",https://g1.globo.com/sp/santos-regiao/noticia/2024/12/05/vereadora-chama-homicida-e-vitima-de-feminicidio-de-doentes-em-sessao-quem-e-pior.ghtml, ✅Clique aqui para seguir o canal do g1 Santos no WhatsApp.
"Motorista de BMW pagou R$ 25 mil por modificação que causou mortes por asfixia de 4 jovens em Balneário Camboriú, diz denúncia",Condutor queria que carro tivesse mais potência e fizesse mais barulho no escapamento. Sócio de oficina e responsável pelo serviço viraram réus.,https://g1.globo.com/sc/santa-catarina/noticia/2024/12/05/motorista-bmw-pagou-25-mil-modificacao-carro-4-mortes-balneario-camboriu.ghtml, ✅Clique e siga o canal do g1 SC no WhatsApp ✅Clique e siga o canal do g1 SC no WhatsApp
"Pelo 2° ano seguido, aniversário de Taubaté, celebrado nesta quinta-feira (5), não é feriado; entenda",Câmara aprovou projeto do prefeito José Saud (PP) em 2022 e medida passou a valer em 2023.,https://g1.globo.com/sp/vale-do-paraiba-regiao/noticia/2024/12/05/pelo-segundo-ano-seguido-aniversario-de-taubate-celebrado-nesta-quinta-5-nao-sera-feriado-entenda.ghtml, ✅ Clique aqui para seguir o novo canal do g1 Vale do Paraíba e região no WhatsApp
Funcionária relata medo após ser atingida por carro que invadiu distribuidora de bebidas: 'Não posso confiar sair na rua',"Funcionária contou que foi ofendida e ameaçada por Sâmia Silva Sá. A motorista chegou a ser presa, mas cumpre prisão domiciliar com tornozeleira eletrônica após passar por audiência de custódia.",https://g1.globo.com/to/tocantins/noticia/2024/12/05/funcionaria-relata-medo-apos-ser-atingida-por-carro-que-invadiu-distribuidora-de-bebidas-nao-posso-confiar-sair-na-rua.ghtml,
