title,description,link,content
Idoso morre em acidente de caminhão e o neto dele é socorrido pelo Samu na MGC-122,"Segundo as informações da Polícia Militar Rodoviária, o condutor contou que a barra de direção quebrou e que o veículo carregado de sucata saiu pela direita, atingindo uma árvore em seguida.",https://g1.globo.com/mg/grande-minas/noticia/2024/12/05/idoso-morre-em-acidente-de-caminhao-e-o-neto-dele-e-socorrido-pelo-samu-na-mgc-122.ghtml, 📲Clique aqui para seguir o canal do g1 Grande Minas no WhatsApp
PM que arremessou homem de ponte em SP trabalhava como segurança em escola particular,O soldado Luan Felipe Alves Pereira era contratado de uma empresa terceirizada que prestava serviços para o Colégio Ábaco. A instituição informou que encerrou os serviços com a empresa.,https://g1.globo.com/sp/sao-paulo/noticia/2024/12/05/pm-que-arremessou-homem-de-ponte-em-sp-trabalhava-como-seguranca-em-escola-particular.ghtml,
MP dá parecer favorável à prisão do suspeito de agredir Paulo Onça em briga de trânsito em Manaus,"Segundo a Polícia Civil, o suspeito deve responder por homicídio tentado qualificado por motivo fútil ou torpe.",https://g1.globo.com/am/amazonas/noticia/2024/12/05/mp-da-parecer-favoravel-a-prisao-do-suspeito-de-agredir-paulo-onca-em-briga-de-transito-em-manaus.ghtml,
"Fiscalização encontra fuzis, pistola, revólver e munições escondidos em carro e prende motorista na Rodovia Raposo Tavares","Segundo a Polícia Civil, as armas de uso restrito apreendidas em Presidente Prudente (SP) nesta quinta-feira (5) normalmente são usadas por quadrilhas de criminosos em assaltos a carros-fortes e roubos a banco e possuem ‘elevadíssima potencialidade lesiva’.",https://g1.globo.com/sp/presidente-prudente-regiao/noticia/2024/12/05/fiscalizacao-encontra-fuzis-pistola-revolver-e-municoes-escondidos-em-carro-e-prende-motorista-na-rodovia-raposo-tavares.ghtml,
"Em Teresópolis, serviço de transbordo de lixo até aterro sanitário licenciado em MG é interrompido",A empresa contratada alega falta de pagamento da Prefeitura. Caminhões de coleta voltaram a descarregar no lixão que está interditado pela Justiça desde 2023.,https://g1.globo.com/rj/regiao-serrana/noticia/2024/12/05/em-teresopolis-servico-de-transbordo-de-lixo-ate-aterro-sanitario-licenciado-em-mg-e-interrompido.ghtml,
"Prefeito de Igarapava, SP, é afastado e diz que decisão é perseguição; vice assume no último mês de mandato","Medida foi tomada após cassação de José Ricardo Rodrigues Mattar (MDB), votada pela maioria dos vereadores. Chefe do Executivo foi denunciado em caso de contratação emergencial de transporte escolar.",https://g1.globo.com/sp/ribeirao-preto-franca/noticia/2024/12/05/prefeito-de-igarapava-sp-e-afastado-e-diz-que-decisao-e-perseguicao-vice-assume-no-ultimo-mes-de-mandato.ghtml,
"Avenida Brasil, em Penedo, é reaberta após parte do asfalto ceder",Pista estava interditada desde quarta-feira. Obras foram concluídas na tarde desta quinta-feira.,https://g1.globo.com/rj/sul-do-rio-costa-verde/noticia/2024/12/05/transito-penedo.ghtml,
"Câmara de São José aprova orçamento de R$ 4,8 bilhões para o município em 2025","Projeto foi votado nesta quinta-feira (5), na Câmara Municipal, e recebeu cinco votos contrários. Educação e Saúde têm maiores despesas para o próximo ano.",https://g1.globo.com/sp/vale-do-paraiba-regiao/noticia/2024/12/05/camara-de-sao-jose-aprova-orcamento-de-r-48-bilhoes-para-o-municipio-em-2025.ghtml, ✅ Clique aqui para seguir o canal do g1 Vale do Paraíba e região no WhatsApp
Mãe de jovem autista que foi assassinada em Taubaté diz sentir alívio com prisão de suspeito e cobra justiça: ‘Covardia muito grande’,"Wellyngton Felipe Nunes da Silva, de 33 anos, principal suspeito de ter cometido o crime, ficará preso por pelo menos 30 dias, durante o andamento da investigação. A vítima, de 25 anos, foi encontrada morta cinco dias após ter desaparecido em Taubaté (SP). Ela tinha autismo severo.",https://g1.globo.com/sp/vale-do-paraiba-regiao/noticia/2024/12/05/mae-de-jovem-autista-que-foi-assassinada-em-taubate-diz-sentir-alivio-com-prisao-de-suspeito-e-cobra-justica-covardia-muito-grande.ghtml, ✅ Clique aqui para seguir o canal do g1 Vale do Paraíba e região no WhatsApp
"Com expansão no Rio de Janeiro, Cresol inaugura sala de negócios em Bom Jardim",Cerimônia de inauguração contou com a presença da presidência e diretoria da cooperativa.,https://g1.globo.com/pr/parana/especial-publicitario/cresol/guia-de-solucoes-financeiras/noticia/2024/12/05/com-expansao-no-rio-de-janeiro-cresol-inaugura-sala-de-negocios-em-bom-jardim.ghtml,
Homem morre em batida entre carro e cegonheira na BR-116,"Motorista do veículo de passeio teria perdido o controle da direção, invadido a contramão e atingido o outro veículo, que vinha em direção contrária. Acidente aconteceu entre Miradouro e Fervedouro.",https://g1.globo.com/mg/zona-da-mata/noticia/2024/12/05/homem-morre-em-batida-entre-carro-e-cegonheira-na-br-116.ghtml," 🔔 Receba no WhatsApp notícias da Zona da Mata e região 📲 Siga o g1 Zona da Mata: Instagram, X e Facebook"
Chuva interdita trecho de estrada no Portão do Inferno em MT e motoristas ficam isolados,"Foram registrados 98 milímetros de chuva em, aproximadamente, duas horas. Com a interdição, diversos motoristas ficaram isolados na estrada.",https://g1.globo.com/mt/mato-grosso/noticia/2024/12/05/chuva-interdita-trecho-de-estrada-no-portao-do-inferno-e-motoristas-ficam-isolados.ghtml, ✅ Clique aqui para seguir o canal do g1 MT no WhatsApp 🚗Rotas alternativas 🗻Obras ✅ Clique aqui para seguir o canal do g1 MT no WhatsApp
AO VIVO: Assista ao GR2,"Acompanhe o GR2 desta quinta-feira (5), com apresentação de João Barbosa",https://g1.globo.com/pe/petrolina-regiao/ao-vivo/ao-vivo-assista-ao-gr2.ghtml,
Concessionária de energia elétrica remove 4 toneladas de fios soltos em postes de Rio Preto neste ano,"Empresas de internet, telefonia e TV a cabo, responsáveis pelo cabeamento, foram notificadas.",https://g1.globo.com/sp/sao-jose-do-rio-preto-aracatuba/noticia/2024/12/05/concessionaria-de-energia-eletrica-remove-4-toneladas-de-fios-soltos-em-postes-de-rio-preto-neste-ano.ghtml,
Polícia prende homem por forjar acidente para matar ex-esposa e receber seguro de vida de R$ 1 milhão em Uberlândia,"O marido é suspeito de desativar o airbag da esposa e provocar acidente com um carro alugado. O crime ocorreu no dia 30 de agosto de 2024 e segundo a Polícia Civil, uma apólice de seguro foi assinada cerca de 20 dias antes.",https://g1.globo.com/mg/triangulo-mineiro/noticia/2024/12/05/apos-forjar-acidente-que-matou-a-ex-esposa-para-receber-seguro-de-vida-de-r-1-milhao-homem-e-preso-em-uberlandia.ghtml," 🔔 Receba no WhatsApp as notícias do Triângulo e região 📲 Siga o g1 Triângulo no Instagram, Facebook e X"
Câmera corporal de PM registra começo de abordagem que terminou com idosa e homem agredidos em Barueri,Caso ocorreu na Rua Mar Negro na noite desta quarta-feira (4); imagem da câmera corporal não mostra o momento das agressões registrado por testemunhas. Corregedoria da PM afastou 12 policiais militares nesta quinta-feira (5).,https://g1.globo.com/sp/sao-paulo/noticia/2024/12/05/camera-corporal-de-pm-registra-comeco-de-abordagem-que-terminou-com-idosa-e-homem-agredidos-em-barueri.ghtml,
Santos retoma linha turística de ônibus com novas rotas para a temporada de verão,"Segundo a Prefeitura de Santos, no litoral de São Paulo, a linha deve passar a operar até o fim deste mês.",https://g1.globo.com/sp/santos-regiao/noticia/2024/12/05/santos-retoma-linha-turistica-de-onibus-com-novas-rotas-para-a-temporada-de-verao.ghtml, ✅Clique aqui para seguir o canal do g1 Santos no WhatsApp.
Operação contra o tráfico de drogas termina com 11 presos em Nanuque,"Durante a ação, policiais apreenderam drogas, dinheiro, uma arma de fogo e munições.",https://g1.globo.com/mg/vales-mg/noticia/2024/12/05/operacao-contra-o-trafico-de-drogas-termina-com-11-presos-em-nanuque.ghtml, 📲 Clique aqui para seguir o canal do g1 Vales no WhatsApp
Crise ou birra?,"Como identificar, prevenir e agir com crianças com TEA.",https://g1.globo.com/pr/parana/especial-publicitario/soulmare-clinica-de-autismo/noticia/2024/12/05/crise-ou-birra.ghtml,
Virgínia presenteia mãe com viagem que ela sonha desde quando era faxineira; vídeo,Margareth Serrão atualmente apresenta um programa de televisão com a filha. Destino da viagem ainda não foi divulgado.,https://g1.globo.com/go/goias/noticia/2024/12/05/virginia-presenteia-mae-com-viagem-que-ela-sonha-desde-quando-era-faxineira.ghtml, ✅ Clique e siga o canal do g1 GO no WhatsApp 📱 Veja outras notícias da região no g1 Goiás.
"Trecho da Rodovia Raposo Tavares é interditado para obras de pavimentação a partir desta sexta-feira, em Presidente Venceslau","Trabalho será realizado até sábado (7), com rota alternativa para motoristas.",https://g1.globo.com/sp/presidente-prudente-regiao/noticia/2024/12/05/trecho-da-rodovia-raposo-tavares-e-interditado-para-obras-de-pavimentacao-a-partir-desta-sexta-feira-em-presidente-venceslau.ghtml, 📱 Participe do Canal do g1 Presidente Prudente e Região no WhatsApp
Petrolina recebe a 16ª edição do Salão de Arte Contemporânea do Sesc PE,"Com a curadoria da instrutora de atividades artísticas do Sesc, Lys Valentim, cidade receberá três desses trabalhos, das artistas Laura Pash, Sarah Rafaely e Bruna Acioly.",https://g1.globo.com/pe/petrolina-regiao/noticia/2024/12/05/petrolina-recebe-a-16a-edicao-do-salao-de-arte-contemporanea-do-sesc-pe.ghtml,
Vereador de cidade da Bahia é condenado a 14 anos de prisão por mandar matar médico,"Crime aconteceu no dia 2 de maio de 2014, quando a vítima saia da academia e foi baleado com tiros na cabeça, na cidade de Paripiranga, a cerca de 400 km de Salvador.",https://g1.globo.com/ba/bahia/noticia/2024/12/05/vereador-condenado-bahia.ghtml, Assista aos vídeos do g1 e TV Bahia 💻
Governo de Roraima recebe nota A em capacidade de pagamento do Tesouro Nacional,"Previsão de orçamento para 2025 é de R$ 8 bilhões, um aumento de 120% se comparado a 2018, quando Antonio Denarium (PP) passou a governar o estado.",https://g1.globo.com/rr/roraima/noticia/2024/12/05/governo-de-roraima-recebe-nota-a-em-capacidade-de-pagamento-do-tesouro-nacional.ghtml, ✅ Receba as notícias do g1 Roraima no WhatsApp
Cães são resgatados em situação de maus-tratos no Sul de Minas,"Ação policial aconteceu em Alfenas e Lavras. Em Lavras (MG), o cão precisou ser eutanasiado após o resgate devido ao diagnóstico de leishmaniose.",https://g1.globo.com/mg/sul-de-minas/noticia/2024/12/05/caes-sao-resgatados-em-situacao-de-maus-tratos-no-sul-de-minas.ghtml,
Professor é preso por estupro em João Pessoa,"De acordo com o IFPB, o homem estava afastado de suas funções como professor da instituição desde a condenação por estupro.",https://g1.globo.com/pb/paraiba/noticia/2024/12/05/professor-e-preso-por-estupro-em-joao-pessoa.ghtml,
177 escolas do Paraná recebem audiência pública para votação de terceirização da gestão; veja lista,"Poderão votar professores, funcionários, responsáveis e estudantes maiores de 18 anos.",https://g1.globo.com/pr/parana/educacao/noticia/2024/12/05/escolas-do-parana-audiencia-publica-projeto-parceiro-da-escola.ghtml, ✅ Siga o canal do g1 PR no WhatsApp✅ Siga o canal do g1 PR no Telegram
VÍDEOS: Histórias Juninas,Histórias de pessoas na Grande São Paulo que fazem a festa junina acontecer.,https://g1.globo.com/sp/sao-paulo/videos-antena-paulista/playlist/videos-historias-juninas.ghtml,
Caso de Stalking: ex-companheiro instala câmeras e contrata vigilância para monitorar mulher em Monte Alegre,"A vítima relatou que teme sair de casa, inclusive para levar seu filho à escola.",https://g1.globo.com/pa/santarem-regiao/noticia/2024/12/05/caso-de-stalking-ex-companheiro-instala-cameras-e-contrata-vigilancia-para-monitorar-mulher-em-monte-alegre.ghtml, ✅ Clique aqui e siga o canal g1 Santarém e Região no WhatsApp
"Não há mais risco de tsunami na Califórnia, dizem autoridades","Terremoto de magnitude 7,0 foi sentido a cerca de 60 km da cidade de Petrolia, nesta quinta-feira (5). Alerta para tsunami chegou a ser emitido para baía de San Francisco, mas cancelado uma hora depois.",https://g1.globo.com/mundo/noticia/2024/12/05/nao-ha-mais-risco-de-tsunami-na-california-dizem-autoridades.ghtml, ✅ Clique aqui para seguir o canal de notícias internacionais do g1 no WhatsApp
Ministro diz que projeto do túnel Santos-Guarujá deve ser encaminhado ao TCU para licitação em 2025,"Declaração do ministro de Portos e Aeroportos, Silvio Costa Filho, aconteceu em um evento em Brasília (DF). Obra é aguardada há quase 100 anos na Baixada Santista.",https://g1.globo.com/sp/santos-regiao/porto-mar/noticia/2024/12/05/ministro-diz-que-projeto-do-tunel-santos-guaruja-deve-ser-encaminhado-ao-tcu-para-licitacao-em-2025.ghtml, ✅ Clique aqui para seguir o novo canal do g1 Santos no WhatsApp.
"Vencedora no Prêmio Multishow, Viviane Batidão promete músicas e parcerias novas para 2025: 'É o Pará no topo!'","Com mais de 25 anos de carreira, a artista têm se destacado no cenário musical nacional, levando o prêmio na categoria ""Brasil"".",https://g1.globo.com/pa/para/noticia/2024/12/05/vencedora-no-premio-multishow-viviane-batidao-promete-musicas-e-parcerias-novas-para-2025-e-o-para-no-topo.ghtml, 📲 Acesse o canal do g1 Pará no WhatsApp
Juiz exige que paciente internado compareça ao fórum para dar continuidade a processo de transferência hospitalar,"Maurílio Rodrigues Araújo, de 60 anos, está sob cuidados na Santa Casa de Ouro Preto desde o último 18 de novembro, em razão de feridas que levaram à amputação do dedão do pé direito. Idoso necessita de procedimento que não é feito em hospitais da região.",https://g1.globo.com/mg/minas-gerais/noticia/2024/12/05/juiz-exige-que-paciente-internado-compareca-ao-forum-para-dar-continuidade-a-processo-de-transferencia-hospitalar.ghtml,
VÍDEO: Homem recebe alta dois dias após ser agredido na maca com cerca de 30 facadas por mulher que invadiu hospital no Paraná,"Homem estava no hospital em Quedas do Iguaçu após ter sido esfaqueado pela mesma mulher na rua. Suspeita é Nilaine de Almeida, que foi presa. Ela não possui defesa constituída.",https://g1.globo.com/pr/oeste-sudoeste/noticia/2024/12/05/video-homem-recebe-alta-dois-dias-apos-ser-agredido-na-maca-com-cerca-de-30-facadas-por-mulher-que-invadiu-hospital-no-parana.ghtml, ✅ Siga o canal do g1 PR no WhatsApp✅ Siga o canal do g1 PR no Telegram
Homem é preso em Belém por armazenar conteúdo de abuso sexual infantil,Prisão é resultado da operação “Rede Segura” da Polícia Civil realizada nesta quinta-feira (5).,https://g1.globo.com/pa/para/noticia/2024/12/05/homem-e-preso-em-belem-por-armazenar-conteudo-de-abuso-sexual-infantil.ghtml, 📲 Acesse o canal do g1 Pará no WhatsApp
MPMG faz operação com foco na administração municipal de Jaíba,"Segundo o MPMG, a ação teve como objetivo desarticular um esquema criminoso instalado na administração municipal que tem a participação de agentes públicos e privados. Estão sob investigação os crimes contra a administração pública e a lavagem de dinheiro.",https://g1.globo.com/mg/grande-minas/noticia/2024/12/05/mpmg-faz-operacao-com-foco-na-administracao-municipal-de-jaiba.ghtml, 📲Clique aqui para seguir o canal do g1 Grande Minas no WhatsApp
Suspeito de envolvimento na morte de PM em 2017 é assassinado a tiros em Barra Mansa,"Ricardo Santos de Oliveira, conhecido como 'Tim Tim', também era apontado pela polícia como autor do tiro que matou um funcionário de uma loja durante um assalto.",https://g1.globo.com/rj/sul-do-rio-costa-verde/noticia/2024/12/05/morte-barra-mansa.ghtml,
Agência da Caixa Econômica Federal de Caruaru é alvo de arrombamento; dupla é detida pela Guarda Civil,"Caso foi registrado na madrugada da quinta-feira (5), no Centro.",https://g1.globo.com/pe/caruaru-regiao/noticia/2024/12/05/agencia-da-caixa-economica-federal-de-caruaru-e-alvo-de-arrombamento-dupla-e-detida-pela-guarda-civil.ghtml, ✅ Receba as notícias do g1 Caruaru e região no seu WhatsApp
"Não há mais risco de tsunami na Califórnia, dizem autoridades","Terremoto de magnitude 7,0 foi sentido a cerca de 60 km da cidade de Petrolia, nesta quinta-feira (5). Alerta para tsunami chegou a ser emitido para baía de San Francisco, mas cancelado uma hora depois.",https://g1.globo.com/mundo/noticia/2024/12/05/nao-ha-mais-risco-de-tsunami-na-california-dizem-autoridades.ghtml, ✅ Clique aqui para seguir o canal de notícias internacionais do g1 no WhatsApp
Ministro diz que projeto do túnel Santos-Guarujá deve ser encaminhado ao TCU para licitação em 2025,"Declaração do ministro de Portos e Aeroportos, Silvio Costa Filho, aconteceu em um evento em Brasília (DF). Obra é aguardada há quase 100 anos na Baixada Santista.",https://g1.globo.com/sp/santos-regiao/porto-mar/noticia/2024/12/05/ministro-diz-que-projeto-do-tunel-santos-guaruja-deve-ser-encaminhado-ao-tcu-para-licitacao-em-2025.ghtml, ✅ Clique aqui para seguir o novo canal do g1 Santos no WhatsApp.
"Vencedora no Prêmio Multishow, Viviane Batidão promete músicas e parcerias novas para 2025: 'É o Pará no topo!'","Com mais de 25 anos de carreira, a artista têm se destacado no cenário musical nacional, levando o prêmio na categoria ""Brasil"".",https://g1.globo.com/pa/para/noticia/2024/12/05/vencedora-no-premio-multishow-viviane-batidao-promete-musicas-e-parcerias-novas-para-2025-e-o-para-no-topo.ghtml, 📲 Acesse o canal do g1 Pará no WhatsApp
Juiz exige que paciente internado compareça ao fórum para dar continuidade a processo de transferência hospitalar,"Maurílio Rodrigues Araújo, de 60 anos, está sob cuidados na Santa Casa de Ouro Preto desde o último 18 de novembro, em razão de feridas que levaram à amputação do dedão do pé direito. Idoso necessita de procedimento que não é feito em hospitais da região.",https://g1.globo.com/mg/minas-gerais/noticia/2024/12/05/juiz-exige-que-paciente-internado-compareca-ao-forum-para-dar-continuidade-a-processo-de-transferencia-hospitalar.ghtml,
VÍDEO: Homem recebe alta dois dias após ser agredido na maca com cerca de 30 facadas por mulher que invadiu hospital no Paraná,"Homem estava no hospital em Quedas do Iguaçu após ter sido esfaqueado pela mesma mulher na rua. Suspeita é Nilaine de Almeida, que foi presa. Ela não possui defesa constituída.",https://g1.globo.com/pr/oeste-sudoeste/noticia/2024/12/05/video-homem-recebe-alta-dois-dias-apos-ser-agredido-na-maca-com-cerca-de-30-facadas-por-mulher-que-invadiu-hospital-no-parana.ghtml, ✅ Siga o canal do g1 PR no WhatsApp✅ Siga o canal do g1 PR no Telegram
Homem é preso em Belém por armazenar conteúdo de abuso sexual infantil,Prisão é resultado da operação “Rede Segura” da Polícia Civil realizada nesta quinta-feira (5).,https://g1.globo.com/pa/para/noticia/2024/12/05/homem-e-preso-em-belem-por-armazenar-conteudo-de-abuso-sexual-infantil.ghtml, 📲 Acesse o canal do g1 Pará no WhatsApp
MPMG faz operação com foco na administração municipal de Jaíba,"Segundo o MPMG, a ação teve como objetivo desarticular um esquema criminoso instalado na administração municipal que tem a participação de agentes públicos e privados. Estão sob investigação os crimes contra a administração pública e a lavagem de dinheiro.",https://g1.globo.com/mg/grande-minas/noticia/2024/12/05/mpmg-faz-operacao-com-foco-na-administracao-municipal-de-jaiba.ghtml, 📲Clique aqui para seguir o canal do g1 Grande Minas no WhatsApp
Suspeito de envolvimento na morte de PM em 2017 é assassinado a tiros em Barra Mansa,"Ricardo Santos de Oliveira, conhecido como 'Tim Tim', também era apontado pela polícia como autor do tiro que matou um funcionário de uma loja durante um assalto.",https://g1.globo.com/rj/sul-do-rio-costa-verde/noticia/2024/12/05/morte-barra-mansa.ghtml,
Agência da Caixa Econômica Federal de Caruaru é alvo de arrombamento; dupla é detida pela Guarda Civil,"Caso foi registrado na madrugada da quinta-feira (5), no Centro.",https://g1.globo.com/pe/caruaru-regiao/noticia/2024/12/05/agencia-da-caixa-economica-federal-de-caruaru-e-alvo-de-arrombamento-dupla-e-detida-pela-guarda-civil.ghtml, ✅ Receba as notícias do g1 Caruaru e região no seu WhatsApp
Top TV Integração 2024 vai premiar as marcas mais lembradas de Uberaba,"A festa de premiação será realizada no Centro de Eventos da Associação Brasileira dos Criadores de Zebu (ABCZ), a partir das 19h30 desta sexta-feira (6).",https://g1.globo.com/mg/triangulo-mineiro/noticia/2024/12/05/top-tv-integracao-2024-vai-premiar-as-marcas-mais-lembradas-de-uberaba.ghtml," 🔔 Receba no WhatsApp as notícias do Triângulo e região 📲 Siga o g1 Triângulo no Instagram, Facebook e X"
Macron acusa esquerda e extrema direita de conluio e reafirma que permanecerá no cargo até o fim do mandato,"Presidente da França fez um pronunciamento na TV um dia após parlamentares derrubarem primeiro-ministro Michel Barnier, escolhido por ele.",https://g1.globo.com/mundo/noticia/2024/12/05/macron-reafirma-que-permanecera-no-cargo-ate-o-fim-do-mandato.ghtml,
Governo deflagra operação para apreender itens proibidos em todos  presídios de MT,"Objetivo é apreender drogas, celulares e carregadores que têm entrado com frequência nas unidades.",https://g1.globo.com/mt/mato-grosso/noticia/2024/12/05/governo-de-mt-deflagra-operacao-para-apreender-itens-proibidos-em-todos-presidios-do-estado.ghtml,
"Homem é morto a facadas durante discussão e corpo é encontrado em matagal, em Jacaraú; suspeitos são presos","De acordo com a Polícia, os suspeitos do crime jogaram o corpo da vítima em um matagal usando um carrinho de mão.",https://g1.globo.com/pb/paraiba/noticia/2024/12/05/homem-e-morto-a-facadas-durante-discussao-e-corpo-e-encontrado-em-matagal-em-jacarau-suspeitos-sao-presos.ghtml,
"Saiba quem é Pedro Guilherme Gioia, superintendente de Vigilância que assume Secretaria de Saúde de Goiânia em meio à crise","Nomeação ocorreu após renúncia de Cynara Mathias, que havia assumido pasta depois da prisão do ex-secretário Wilson Pollara. Novo secretário é formado em administração de empresas",https://g1.globo.com/go/goias/noticia/2024/12/05/saiba-quem-e-pedro-guilherme-gioia-superintendente-de-vigilancia-que-assume-secretaria-de-saude-de-goiania-em-meio-a-crise.ghtml, ✅ Clique e siga o canal do g1 GO no WhatsApp 📱 Veja outras notícias da região no g1 Goiás.
"Réveillon de Fortaleza 2025 não terá mais três dias de festa, diz prefeitura",A prefeitura informou que não há patrocínio suficiente para todos os artistas.,https://g1.globo.com/ce/ceara/noticia/2024/12/05/reveillon-de-fortaleza-2025-nao-tera-mais-tres-dias-de-festa-diz-prefeitura.ghtml,
Influencers Lais Oliveira e Eduardo Veloso são presos em Fortaleza por envolvimento em 'jogo do tigrinho',"O mandado de prisão foi expedido pela Justiça de Alagoas por participação em organização criminosa. Lais tem 4,8 milhões de seguidores em uma rede social; na mesma, Eduardo tem 635 mil. Eles estavam passando férias na capital.",https://g1.globo.com/ce/ceara/noticia/2024/12/05/influencers-lais-oliveira-e-eduardo-veloso-sao-presos-em-fortaleza-por-envolvimento-em-jogos-de-azar.ghtml, ✅ Siga o canal do g1 Ceará no WhatsApp
Polícia pede prisão de suspeito de agredir Paulo Onça durante briga de trânsito em Manaus,"Caso aconteceu na madrugada desta quinta-feira (5). Sambista foi conduzido para o Hospital e Pronto Socorro Dr. João Lúcio, onde passou por cirurgia durante a madrugada.",https://g1.globo.com/am/amazonas/noticia/2024/12/05/policia-pede-prisao-de-suspeito-de-agredir-paulo-onca-durante-briga-de-transito-em-manaus.ghtml,
"Corretor de grãos e a esposa aplicavam golpes milionários para ostentar e manter vida de luxo, diz delegado","Vinicius Mello e Camila Melo estão foragidos e a suspeita é que eles tenham fugido para os Estados Unidos. Ação policial apreendeu quase 470 veículos, aeronaves e pediu o bloqueio de R$ 19 bilhões.",https://g1.globo.com/go/goias/noticia/2024/12/05/corretor-de-graos-e-a-esposa-aplicavam-golpes-milionarios-para-ostentar-e-manter-vida-de-luxo-diz-delegado.ghtml, ✅ Clique e siga o canal do g1 GO no WhatsApp 📱 Veja outras notícias da região no g1 Goiás.
Descarte irregular de lixo faz prefeitura instalar barreira de concreto em avenida de Governador Valadares,Ação educativa foi feita no local para conscientizar os moradores. Denúncias de descarte irregular são uma  reclamação constante da população em vários pontos da cidade.,https://g1.globo.com/mg/vales-mg/noticia/2024/12/05/descarte-irregular-de-lixo-faz-prefeitura-instalar-barreira-de-concreto-em-avenida-de-governador-valadares.ghtml, 🔔 Clique aqui para seguir o canal do g1 Vales no WhatsApp
Governo quer que 99% da população esteja a menos de 4 horas de um aeroporto,"Ministério de Portos e Aeroportos lançou nesta quinta (5) planos setoriais de portos, aeroportos e hidrovias. Contando com plano ferroviário, são 1.711 projetos de infraestrutura previstos até 2035.",https://g1.globo.com/economia/noticia/2024/12/05/governo-lanca-plano-para-viabilizar-15-mil-empreendimentos-no-setor-de-portos-aeroportos-e-hidrovias.ghtml," ✈ O plano de aviação civil foi publicado em 2018 e passa por uma atualização. Segundo Franca, o ministério modificou as indicações de investimentos, reduzindo a distância entre os aeródromos e os centros populacionais."
