title,description,link,content
VÍDEO: capivara é resgatada após 'invadir' casa em Piraju,"Animal foi resgatado pelo Corpo de Bombeiros e solto na Floresta Municipal das Corredeiras Clóvis Deléo, em Piraju (SP).",https://g1.globo.com/sp/itapetininga-regiao/noticia/2024/12/04/video-capivara-e-resgatada-apos-invadir-casa-em-piraju.ghtml,
Chuva de granizo atinge cidades do interior do RN; veja vídeo,Fenômeno foi registrado nesta quarta-feira (4) em cidades como Ipueira e Serra Negra do Norte. Meteorologista explicou que granizo se forma em nuvens verticais longas.,https://g1.globo.com/rn/rio-grande-do-norte/noticia/2024/12/04/chuva-de-granizo-rn-video.ghtml,
"Drive-thru arrecada alimentos destinados à Campanha Natal Sem Fome no Parque do Povo, em Presidente Prudente","Ação será das 8h às 13h, no recuo da Avenida 14 de Setembro, na Vila Cláudia Glória.",https://g1.globo.com/sp/presidente-prudente-regiao/noticia/2024/12/04/drive-thru-arrecada-alimentos-destinados-a-campanha-natal-sem-fome-no-parque-do-povo-em-presidente-prudente.ghtml, 📱 Participe do Canal do g1 Presidente Prudente e Região no WhatsApp
Trinta pessoas são presas no Pará em operação de combate ao tráfico de drogas e facções criminosas,O balanço foi divulgado nesta quarta-feira (4). Outras cinco prisões ocorreram foram do estado.,https://g1.globo.com/pa/para/noticia/2024/12/04/trinta-pessoas-sao-presas-no-para-em-operacao-de-combate-ao-trafico-de-drogas-e-faccoes-criminosas.ghtml, 📲 Acesse o canal do g1 Pará no WhatsApp
Polícia investiga agressão a criança de quatro anos em Sorocaba,Caso é acompanhado pelo Conselho Tutelar. Menino foi atendido na UBS Carandá e vai passar por exame de corpo de delito e escuta especializada no Gpaci.,https://g1.globo.com/sp/sorocaba-jundiai/noticia/2024/12/04/policia-investiga-agressao-a-crianca-de-quatro-anos-em-sorocaba.ghtml,
Rapaz é preso em flagrante após furtar bicicleta no campus da Unesp e romper tornozeleira eletrônica em Presidente Prudente,"Policiais militares abordaram o suspeito, de 27 anos, na Cohab.",https://g1.globo.com/sp/presidente-prudente-regiao/noticia/2024/12/04/rapaz-e-preso-em-flagrante-apos-furtar-bicicleta-no-campus-da-unesp-e-romper-tornozeleira-eletronica-em-presidente-prudente.ghtml, 📱 Participe do Canal do g1 Presidente Prudente e Região no WhatsApp
Empresa de vistoria em Paulínia suspeita de fabricar placas falsas de veículos é fechada,Operação apreendeu materiais falsificados e prendeu responsável pelo estabelecimento em flagrante.,https://g1.globo.com/sp/campinas-regiao/noticia/2024/12/04/empresa-de-vistoria-em-paulinia-suspeita-de-fabricar-placas-falsas-de-veiculos-e-fechada.ghtml, 🔔 Receba as notícias do g1 Campinas no WhatsApp
Número de tentativa de feminicídios aumenta cerca de 20% em Sergipe,"Contudo, os dados da SSP mostram ainda que o número de mulheres mortas, vítimas de feminicídio, diminuiu.",https://g1.globo.com/se/sergipe/noticia/2024/12/04/tentativa-de-feminicidios-sergipe.ghtml, ✅ Clique aqui para seguir o canal do g1 SE no WhatsApp
"Corais, orquestras e artistas regionais são parte da programação de natal na Praça dos Girassóis","De acordo com o Governo, programação começa no dia 12 de dezembro. Montagem da decoração do 'Natal de Luz' já começou.",https://g1.globo.com/to/tocantins/noticia/2024/12/04/corais-orquestras-e-artistas-regionais-sao-parte-da-programacao-de-natal-na-praca-dos-girassois.ghtml,
Operação de combate à violência contra criança e adolescente registra 700 ocorrências de crimes no Pará,"Ao todo, 1.242 vítimas foram atendidas só no mês de novembro, segundo balanço divulgado nesta quarta-feira (4) pela polícia.",https://g1.globo.com/pa/para/noticia/2024/12/04/operacao-de-combate-a-violencia-contra-crianca-e-adolescente-registra-700-ocorrencias-de-crimes-no-para.ghtml, 📲 Acesse o canal do g1 Pará no WhatsApp
"Erika Hilton, Rachel Reis e mais: confira programação do Festival Literário de Cajazeiras","Evento acontece entre esta quinta-feira (5) e o próximo sábado (7), no Ginásio Poliesportivo de Cajazeiras.",https://g1.globo.com/ba/bahia/o-que-fazer-em-salvador/noticia/2024/12/05/festival-literario-de-cajazeiras-programacao.ghtml, 📅 5 de dezembro (quinta-feira) 📅 6 de dezembro (sexta-feira) 📅 7 de dezembro (sábado) Assista aos vídeos do g1 e TV Bahia 💻
O que está por trás da profunda crise na Volkswagen,A Volkswagen sofre com perdas de lucros e vendas em todo o mundo; o plano de poupança proposto aos sindicatos na Alemanha desencadeou greves num momento de instabilidade política no país.,https://g1.globo.com/carros/noticia/2024/12/05/o-que-esta-por-tras-da-profunda-crise-na-volkswagen.ghtml,
PM acusado de atirar em jovem no show da dupla Henrique e Juliano vai a júri popular nesta quinta-feira,"Vítima foi atingida por três tiros e passou dias internado, mas já recebeu alta. Defesa afirmou que o acusado está em liberdade.",https://g1.globo.com/go/goias/noticia/2024/12/05/pm-acusado-de-atirar-em-jovem-no-show-da-dupla-henrique-e-juliano-vai-a-juri-popular-nesta-quinta-feira.ghtml, ✅ Clique e siga o canal do g1 GO no WhatsApp 📱 Veja outras notícias da região no g1 Goiás.
Curso de Engenharia Ferroviária da UFSC tem um único inscrito para o vestibular; conheça o candidato,"João Francisco Rubbo Nobre tem 18 anos e acredita que uma boa estrutura ferroviária é fundamental para o desenvolvimento de um país. Natural de Valinhos (SP), ele vai fazer vestibular em Joinville.",https://g1.globo.com/sc/santa-catarina/noticia/2024/12/05/unico-inscrito-engenharia-ferroviaria-ufsc.ghtml, ✅Clique e siga o canal do g1 SC no WhatsApp ✅Clique e siga o canal do g1 SC no WhatsApp
"Prefeitura de Barracão abre concurso público com salários de até R$ 12,7 mil; veja como se inscrever","As inscrições começaram nesta quinta-feira (5) e podem ser feitas até 9 de janeiro. Há vagas para dentista, contador, médico, operador de máquinas, entre outros.",https://g1.globo.com/pr/oeste-sudoeste/noticia/2024/12/05/prefeitura-de-barracao-abre-concurso-publico-com-salarios-de-ate-r-127-mil-veja-como-se-inscrever.ghtml, ✅ Siga o canal do g1 PR no WhatsApp✅ Siga o canal do g1 PR no Telegram Provas 📝
Bazar beneficente em Curitiba tem peças de roupas com descontos de até 70%; veja como participar,"Segundo organização do evento, estarão disponíveis sapatos, chinelos, óculos, além de outros acessórios.",https://g1.globo.com/pr/parana/economia/noticia/2024/12/05/bazar-beneficente-em-curitiba-tem-pecas-de-roupas-com-descontos-de-ate-70percent-veja-como-participar.ghtml, ✅ Siga o canal do g1 PR no WhatsApp✅ Siga o canal do g1 PR no Telegram
Conselhos de uma jovem para a convivência entre gerações,"“Os mais velhos têm que ‘desligar’ seu cérebro de professor ou pai/mãe, da figura que detém a autoridade”, ensina Denise Webb",https://g1.globo.com/bemestar/blog/longevidade-modo-de-usar/post/2024/12/05/conselhos-de-uma-jovem-para-a-convivencia-entre-geracoes.ghtml,
"Stray Kids fala de vinda ao Brasil e diz querer ir além do k-pop... reggae, metal e soul estão na mira","Ao g1, grupo sul-coreano também comenta trilha sonora da série 'Arcane', que tem o guitarrista Tom Morello, do Rage Against the Machine, e a rapper Young Miko.",https://g1.globo.com/pop-arte/musica/noticia/2024/12/05/stray-kids-fala-de-vinda-ao-brasil-e-diz-querer-ir-alem-do-k-pop-reggae-metal-e-soul-estao-na-mira.ghtml,
Confira as 235 vagas de emprego disponíveis em Petrolina e Salgueiro nesta quinta-feira (5),As vagas são disponibilizadas diariamente pela Agência do Trabalho de Pernambuco.,https://g1.globo.com/pe/petrolina-regiao/noticia/2024/12/05/confira-as-235-vagas-de-emprego-disponiveis-em-petrolina-e-salgueiro-nesta-quinta-feira-5.ghtml, ✅ Clique aqui para seguir o canal do g1 Concursos no WhatsApp.
Mulher que morreu após procedimentos estético era servidora pública da Prefeitura de Goiânia e deixa dois filhos,Dona da clínica onde o procedimento foi realizado está presa. Defesa dela diz que ela tem liberação para realizar os procedimentos e que o produto usado é legal.,https://g1.globo.com/go/goias/noticia/2024/12/05/mulher-que-morreu-apos-procedimentos-estetico-era-servidora-publica-da-prefeitura-de-goiania-e-deixa-dois-filhos.ghtml, ✅ Clique e siga o canal do g1 GO no WhatsApp 📱 Veja outras notícias da região no g1 Goiás.
"Entregador morre em acidente com caminhão em Ananindeua, na Grande Belém",Vítima identificada como Anderson da Silva Quaresma não resistiu aos ferimentos e morreu no local.,https://g1.globo.com/pa/para/noticia/2024/12/04/motociclista-morre-em-acidente-com-caminhao-em-ananindeua-na-rmb.ghtml, 📲 Acesse o canal do g1 Pará no WhatsApp
VÍDEO: PMs agridem motociclista rendido e mulher durante abordagem policial na Zona Norte de SP,A SSP informou que os policiais que participaram da ação já foram identificados e foi aberta uma investigação preliminar para apurar a conduta dos policiais.,https://g1.globo.com/sp/sao-paulo/noticia/2024/12/04/video-pms-agridem-motociclista-rendido-e-mulher-durante-abordagem-policial-na-zona-norte-de-sp.ghtml,
Justiça da PB determina transferência de detentos da Cadeia de Bayeux,Decisão foi tomada em uma ação civil movida pelo Ministério Público da Paraíba em razão da superlotação da Cadeia Pública de Bayeux.,https://g1.globo.com/pb/paraiba/noticia/2024/12/04/justica-da-pb-determina-transferencia-de-detentos-da-cadeia-de-bayeux.ghtml,
Pintor morre 11 dias após ser agredido em posto de combustíveis em Jaboticabal; VÍDEO,Câmera de segurança registrou agressão em 23 de novembro. Vítima ficou internada por dez dias na Santa Casa de Sertãozinho (SP).,https://g1.globo.com/sp/ribeirao-preto-franca/noticia/2024/12/04/pintor-morre-11-dias-apos-ser-agredido-em-posto-de-combustiveis-em-jaboticabal-video.ghtml,
"JAM 1 - Edição de quarta-feira, 4 de dezembro de 2024:",Confira as reportagens exibidas no Jornal do Amazonas 1ª Edição desta segunda-feira (25).,https://g1.globo.com/am/amazonas/playlist/jam-1-edicao-de-quarta-feira-4-de-dezembro-de-2024.ghtml,
Operação prende 108 suspeitos de violência contra crianças e adolescentes em um mês no Ceará,A operação ainda resultou em nove apreensões de adolescentes.,https://g1.globo.com/ce/ceara/noticia/2024/12/04/operacao-prende-108-suspeitos-de-violencia-contra-criancas-e-adolescentes-em-um-mes-no-ceara.ghtml,
Moradores de assentamento reclamam de falta de energia elétrica  e prejuízos: ‘Estamos perdendo a comida’,"Famílias que moram no assentamento São Francisco, em Porto Nacional, ficaram cerca de cinco dias sem energia. Energisa disse que os problemas no fornecimento foram solucionados.",https://g1.globo.com/to/tocantins/noticia/2024/12/04/moradores-de-assentamento-reclamam-de-falta-de-energia-eletrica-e-prejuizos-estamos-perdendo-a-comida.ghtml,
"Carro abandonado após queda em córrego em Franca, SP, é levado pela correnteza um dia após acidente",Veículo era alugado e empresa afirma que não foi procurada por locatário. Ocupantes ainda não foram localizados.,https://g1.globo.com/sp/ribeirao-preto-franca/noticia/2024/12/04/carro-abandonado-apos-queda-em-corrego-em-franca-sp-e-levado-pela-correnteza-um-dia-depois-de-acidente.ghtml,
Capivara com ferida exposta é encontrada em parque de Curitiba; moradores pedem resgate há uma semana,"Capivara também está com a pata esquerda paralisada. Moradores já somam cinco protocolos de pedido de resgate. Prefeitura diz que tenta resgatar o animal desde a primeira denúncia, mas sem sucesso.",https://g1.globo.com/pr/parana/noticia/2024/12/04/capivara-com-ferida-exposta-e-encontrada-em-parque-de-curitiba-moradores-pedem-resgate-ha-uma-semana.ghtml, ✅ Siga o canal do g1 PR no WhatsApp✅ Siga o canal do g1 PR no Telegram
Justiça acolhe denúncia do MP e rapaz que matou 5 cães de sua mãe vira réu em Limeira,"Em depoimento, ele afirmou que matou os animais porque estavam sofrendo com doenças. A mãe dele negou e disse que o filho não gostava dos cachorros.",https://g1.globo.com/sp/piracicaba-regiao/noticia/2024/12/04/justica-acolhe-denuncia-do-mp-e-rapaz-que-matou-5-caes-de-sua-mae-vira-reu-em-limeira.ghtml,
"VÍDEO: porta abre e passageira é arremessada de ônibus do Transcol em movimento, em Vitória","Acidente aconteceu nesta quarta-feira (4). No momento em que veículo fez uma curva, porta abriu e jovem foi arremessada.",https://g1.globo.com/es/espirito-santo/noticia/2024/12/05/video-porta-abre-e-passageira-e-arremessada-de-onibus-do-transcol-em-movimento-em-vitoria.ghtml, 📲 Clique aqui para seguir o canal do g1 ES no WhatsApp
"Ivan Lins, Magia Negra e Djuena: veja as atrações da agenda cultural no noroeste paulista","O g1 separou algumas das atrações culturais que ocorrem nas regiões de São José do Rio Preto e Araçatuba (SP), entre esta quinta-feira (5) e domingo (8).",https://g1.globo.com/sp/sao-jose-do-rio-preto-aracatuba/noticia/2024/12/05/ivan-lins-magia-negra-e-djuena-veja-as-atracoes-da-agenda-cultural-no-noroeste-paulista.ghtml,
Turista brasileira denuncia assalto e tentativa de estupro em apartamento alugado na França,Marcela Carvalho ficou hospedada na capital francesa com outras duas amigas. Ela denunciou que teve o apartamento invadido por sete homens armados no último dia de viagem.,https://g1.globo.com/mg/minas-gerais/noticia/2024/12/05/brasileira-denuncia-assalto-e-tentativa-de-estupro-apos-ter-apartamento-alugado-por-airbnb-invadido-na-franca.ghtml,
Acidente com guindaste na represa de Chapéu d'Uvas deixa dois trabalhadores feridos,"Operador da estrutura contou que, ao descer a gaiola com dois profissionais enquanto realizava a manutenção de um talude, o braço do maquinário cedeu de forma inesperada. Um deles foi socorrido inconsciente.",https://g1.globo.com/mg/zona-da-mata/noticia/2024/12/05/acidente-com-guindaste-na-represa-de-chapeu-duvas-deixa-dois-trabalhadores-feridos.ghtml," 🔔 Receba no WhatsApp notícias da Zona da Mata e região 📲 Siga o g1 Zona da Mata: Instagram, X e Facebook"
MP pede bloqueio de R$ 10 milhões da Copasa e interrupção da cobrança de água em Peçanha após laudo apontar contaminação,"Segundo a promotoria, uma análise técnica apontou que a água fornecida à população é imprópria para o consumo humano. Um boi teria sido flagrado dentro manacial que abastece a cidade.",https://g1.globo.com/mg/vales-mg/noticia/2024/12/05/mp-pede-bloqueio-de-r-10-milhoes-da-copasa-e-interrupcao-da-cobranca-agua-em-pecanha-apos-laudo-apontar-contaminacao.ghtml, 📲 Clique aqui para seguir o canal do g1 Vales no WhatsApp
Deputados estaduais aprovam projeto que flexibiliza licenciamento ambiental no Paraná,"Após discussão, projeto recebeu 47 emendas parlamentares, das quais 22 foram acatadas pela Comissão de Constituição e Justiça (CCJ). Proposta segue para sanção do governador Ratinho Junior (PSD).",https://g1.globo.com/pr/parana/noticia/2024/12/05/deputados-estaduais-aprovam-projeto-licenciamento-ambiental-no-parana.ghtml, ✅ Siga o canal do g1 PR no WhatsApp✅ Siga o canal do g1 PR no Telegram
Jogo do tigrinho: polícia investiga influenciadoras digitais de SP por lavagem de dinheiro obtido com 'golpe do investimento' no RS,Vítimas sofreram prejuízos que chegam até R$ 400 mil. Investigadas ostentam vida de luxo nas redes sociais.,https://g1.globo.com/rs/rio-grande-do-sul/noticia/2024/12/05/jogo-do-tigrinho-policia-investiga-influenciadoras-digitais-de-sp-por-lavagem-de-dinheiro-obtido-com-golpe-do-investimento-no-rs.ghtml, 📲 Acesse o canal do g1 RS no WhatsApp
"Mais de dez anos depois, eletricista é preso por abrir fogo e deixar ferido em bingo no Ceará",O suspeito afirmou que se envolveu na confusão porque um indivíduo estaria importunando sua companheira com piadas.,https://g1.globo.com/ce/ceara/noticia/2024/12/05/mais-de-dez-anos-depois-eletricista-e-preso-por-abrir-fogo-e-deixar-ferido-em-bingo-no-ceara.ghtml, ✅ Clique aqui para seguir o canal do g1 Ceará no WhatsApp
Centro terapêutico de Mairinque é interditado após denúncias de irregularidades,"Segundo a Prefeitura de Mairinque, a clínica descumpria normas sanitárias. Dois pacientes foram levados para Pronto Atendimento do munícipio, e os demais foram encaminhados para suas famílias.",https://g1.globo.com/sp/sorocaba-jundiai/noticia/2024/12/05/centro-terapeutico-de-mairinque-e-interditado-apos-denuncias-de-irregularidades.ghtml,
Fotógrafo desaparecido na França: governo de MG pede informações sobre o caso ao Itamaraty,"Em documento, governador Zema solicita que seja informado sobre as investigações do desaparecimento de Flávio de Castro Souza. Brasileiro foi visto pela última vez em Paris, no último 26 de novembro.",https://g1.globo.com/mg/minas-gerais/noticia/2024/12/05/fotografo-desaparecido-na-franca-governo-de-minas-pede-informacoes-sobre-o-caso-ao-itamaraty.ghtml,
"Não fiz nada demais, diz sul-coreana que conteve ofensiva de militares durante lei marcial","Ahn Gwi-ryeong, ex-jornalista e porta-voz de partido, foi filmada colocando a mão na frente do fuzil de um militar na porta do Parlamento, em Seul, logo após o presidente do país decretar a lei marcial, que foi derrubada depois.",https://g1.globo.com/mundo/noticia/2024/12/05/nao-fiz-nada-demais-diz-sul-coreana-que-conteve-ofensiva-de-militares-durante-lei-marcial.ghtml, ✅ Clique aqui para seguir o canal de notícias internacionais do g1 no WhatsApp
Van envolvida em acidente no Paraná transportava padre e missionários que atuavam em Mogi; uma pessoa morreu,"Acidente ocorreu nesta quinta-feira (5), na PR-317, no norte do Paraná. Homem que morreu foi identificado pelos bombeiros como Paulo Jesus dos Santos, de 65 anos. Grupo de missionários e padre atuavam na Associação São Lourenço, em Mogi das Cruzes.",https://g1.globo.com/sp/mogi-das-cruzes-suzano/noticia/2024/12/05/van-envolvida-em-acidente-no-parana-transportava-padre-e-missionarios-que-atuavam-em-mogi-uma-pessoa-morreu.ghtml, ✅ Clique para seguir o canal do g1 Mogi das Cruzes e Suzano no WhatsApp
Adolescente suspeito de matar professor no MA é apreendido no Pará,"Adailson Sousa Pereira foi morto em casa, em Maracaçumé.",https://g1.globo.com/ma/maranhao/noticia/2024/12/05/adolescente-suspeito-de-matar-professor-no-maranhao-e-preso-no-para.ghtml, ✅ Clique aqui para seguir o canal do g1 Maranhão no WhatsApp
Prefeitura do Rio detecta caso de nova variante da Covid,"Notificação foi feita pela Fiocruz. Paciente é uma mulher de 37 anos, que não teve nenhum sintoma grave.",https://g1.globo.com/rj/rio-de-janeiro/noticia/2024/12/05/prefeitura-do-rio-detecta-caso-de-nova-variante-da-covid.ghtml,
"VÍDEO: porta abre e passageira é arremessada de ônibus do Transcol em movimento, em Vitória","Acidente aconteceu nesta quarta-feira (4). No momento em que veículo fez uma curva, porta abriu e jovem foi arremessada.",https://g1.globo.com/es/espirito-santo/noticia/2024/12/05/video-porta-abre-e-passageira-e-arremessada-de-onibus-do-transcol-em-movimento-em-vitoria.ghtml, 📲 Clique aqui para seguir o canal do g1 ES no WhatsApp
"Ivan Lins, Magia Negra e Djuena: veja as atrações da agenda cultural no noroeste paulista","O g1 separou algumas das atrações culturais que ocorrem nas regiões de São José do Rio Preto e Araçatuba (SP), entre esta quinta-feira (5) e domingo (8).",https://g1.globo.com/sp/sao-jose-do-rio-preto-aracatuba/noticia/2024/12/05/ivan-lins-magia-negra-e-djuena-veja-as-atracoes-da-agenda-cultural-no-noroeste-paulista.ghtml,
Turista brasileira denuncia assalto e tentativa de estupro em apartamento alugado na França,Marcela Carvalho ficou hospedada na capital francesa com outras duas amigas. Ela denunciou que teve o apartamento invadido por sete homens armados no último dia de viagem.,https://g1.globo.com/mg/minas-gerais/noticia/2024/12/05/brasileira-denuncia-assalto-e-tentativa-de-estupro-apos-ter-apartamento-alugado-por-airbnb-invadido-na-franca.ghtml,
Acidente com guindaste na represa de Chapéu d'Uvas deixa dois trabalhadores feridos,"Operador da estrutura contou que, ao descer a gaiola com dois profissionais enquanto realizava a manutenção de um talude, o braço do maquinário cedeu de forma inesperada. Um deles foi socorrido inconsciente.",https://g1.globo.com/mg/zona-da-mata/noticia/2024/12/05/acidente-com-guindaste-na-represa-de-chapeu-duvas-deixa-dois-trabalhadores-feridos.ghtml," 🔔 Receba no WhatsApp notícias da Zona da Mata e região 📲 Siga o g1 Zona da Mata: Instagram, X e Facebook"
MP pede bloqueio de R$ 10 milhões da Copasa e interrupção da cobrança de água em Peçanha após laudo apontar contaminação,"Segundo a promotoria, uma análise técnica apontou que a água fornecida à população é imprópria para o consumo humano. Um boi teria sido flagrado dentro manacial que abastece a cidade.",https://g1.globo.com/mg/vales-mg/noticia/2024/12/05/mp-pede-bloqueio-de-r-10-milhoes-da-copasa-e-interrupcao-da-cobranca-agua-em-pecanha-apos-laudo-apontar-contaminacao.ghtml, 📲 Clique aqui para seguir o canal do g1 Vales no WhatsApp
Ganhador da Mega-Sena que morreu em Cuiabá é velado na cidade natal,"Há pouco mais de 20 dias, Antônio Lopes Siqueira, de 73 anos, apostou R$ 5 e ganhou R$ 201 milhões. Ele morreu durante um tratamento odontológico.",https://g1.globo.com/mt/mato-grosso/noticia/2024/12/05/ganhador-da-mega-sena-que-morreu-em-cuiaba-e-velado-na-cidade-natal.ghtml,
Homem consulta extrato de banco e descobre prejuízo de R$ 21 mil em Rio Preto,"Vítima percebeu que o valor de pensão recebido estava diferente do que sempre recebe mensalmente e, quando tirou o extrato, viu que cinco empréstimos foram realizados.",https://g1.globo.com/sp/sao-jose-do-rio-preto-aracatuba/noticia/2024/12/05/homem-consulta-extrato-de-pensao-em-banco-e-descobre-prejuizo-em-rio-preto.ghtml,
UEPB vai oferecer quase 6 mil vagas no Sisu 2025,"Vagas serão distribuídas em duas entradas. Para o primeiro semestre serão 3.209 oportunidades. Já para o segundo, serão 2.761.",https://g1.globo.com/pb/paraiba/noticia/2024/12/05/uepb-vai-oferecer-quase-6-mil-vagas-no-sisu-2025.ghtml, 📲Compartilhar esta notícia pelo Whatsapp 📲Compartilhar esta notícia pelo Whatsapp
"BC expõe dados de 1,5 mil participantes de pesquisa sobre relação do brasileiro com dinheiro",Banco Central informou que as pessoas que tiveram dados indevidamente expostos serão notificadas por carta. E recomendou que entrevistados tomem cuidado caso sejam abordados.,https://g1.globo.com/economia/noticia/2024/12/05/bc-expoe-dados-de-1500-pessoas-que-participaram-de-pesquisa-sobre-a-relacao-do-brasileiro-com-dinheiro.ghtml,
"Aviões presidenciais de Putin foram usados para deportar crianças ucranianas, diz pesquisa apoiada pelo governo dos EUA","Levantamento da Escola de Saúde Pública de Yale, em Connecticut, mostrou que crianças foram levadas de territórios ucranianos ocupados nas aeronaves, tiveram suas identidades retiradas e foram colocas em famílias russas.",https://g1.globo.com/mundo/ucrania-russia/noticia/2024/12/05/avioes-presidenciais-de-putin-foram-usados-para-deportar-criancas-ucranianas-diz-pesquisa-apoiada-pelo-governo-dos-eua.ghtml, ✅ Clique aqui para seguir o canal de notícias internacionais do g1 no WhatsApp
Júri popular de acusados da morte de Nataly Lily é realizado em Mogi das Cruzes,"Nataly foi vista pela última vez em dezembro de 2020. Ela e uma amiga foram contratadas por um casal para um programa sexual e levadas até um sítio próximo à Avenida das Orquídeas, entre Mogi das Cruzes e Suzano.",https://g1.globo.com/sp/mogi-das-cruzes-suzano/noticia/2024/12/05/juri-popular-de-acusados-da-morte-de-nataly-lily-e-realizado-em-mogi-das-cruzes.ghtml,
Condenado por matar policial durante assalto em posto de combustíveis é preso mais de 10 anos depois,Crime ocorreu em São Vicente (SP) e acusado foi detido em Praia Grande.,https://g1.globo.com/sp/santos-regiao/noticia/2024/12/05/condenado-por-matar-policial-durante-assalto-em-posto-de-combustiveis-e-preso-mais-de-10-anos-depois.ghtml, ✅ Clique aqui para seguir o novo canal do g1 Santos no WhatsApp.
PF prende investigado por produzir imagens de abuso sexual infantil na Grande Aracaju,A investigação foi iniciada a partir da análise de imagens enviadas por uma agência policial australiana à Interpol.,https://g1.globo.com/se/sergipe/noticia/2024/12/05/investigado-por-producao-de-imagens-de-abuso-sexual-infantil-e-preso-na-grande-aracaju.ghtml, ✅ Clique aqui para seguir o canal do g1 SE no WhatsApp
"Quase metade da população do Piauí é pobre e cerca de 70% está abaixo do índice nacional de estudo, diz IBGE",Os dados são da Síntese de Indicadores Sociais (SIS) divulgada pelo Instituto Brasileiro de Geografia e Estatística.,https://g1.globo.com/pi/piaui/noticia/2024/12/05/quase-metade-da-populacao-do-piaui-e-pobre-e-cerca-de-70percent-esta-abaixo-do-indice-nacional-de-estudo-diz-ibge.ghtml," ✅ Siga o canal do g1 Piauí no WhatsApp 📲 Confira as últimas notícias do g1 Piauí📲 Acompanhe o g1 Piauí no Facebook, no Instagram e no X"
Sicredi destaca cooperativismo e apoio negócios na Feira Pará Negócios,"Durante três dias de evento, a instituição financeira cooperativa apresentou soluções financeiras a empresas de todos os portes e segmentos",https://g1.globo.com/pa/para/especial-publicitario/sicredi-norte/sicredi-gente-que-coopera-cresce/noticia/2024/12/05/sicredi-destaca-cooperativismo-e-apoio-negocios-na-feira-para-negocios.ghtml,
